[{"title":"Say hello to Dynatic","slug":"say-hello-to-dynatic","date":"14/03/2016","author":"Dynatic","layout":"Post","content":"\n# Say hello to Dynatic\n\n---\n\nLorem ipsum dolor sit amet, consectetur adipisicing elit, sed do eiusmod tempor\nincididunt ut labore et dolore magna aliqua. Ut enim ad minim veniam, quis\nnostrud exercitation ullamco laboris nisi ut aliquip ex ea commodo consequat.\nDuis aute irure dolor in reprehenderit in voluptate velit esse cillum dolore eu\nfugiat nulla pariatur. Excepteur sint occaecat cupidatat non proident, sunt in\nculpa qui officia deserunt mollit anim id est laborum.\n\n| Tables        | Are           | Cool  |\n| ------------- |:-------------:| -----:|\n| col 3 is      | right-aligned | $1600 |\n| col 2 is      | centered      |   $12 |\n| zebra stripes | are neat      |    $1 |\n\n```markdown\n---\nslug: say-hello-to-dynatic\ntitle: Say hello to Dynatic\ndate: 14/03/2016\nauthor: Dynatic\nlayout: Post\n---\n\n# Say hello to Dynatic\n\n---\n\nLorem ipsum dolor sit amet, consectetur adipisicing elit, sed do eiusmod tempor\nincididunt ut labore et dolore magna aliqua. Ut enim ad minim veniam, quis\nnostrud exercitation ullamco laboris nisi ut aliquip ex ea commodo consequat.\nDuis aute irure dolor in reprehenderit in voluptate velit esse cillum dolore eu\nfugiat nulla pariatur. Excepteur sint occaecat cupidatat non proident, sunt in\nculpa qui officia deserunt mollit anim id est laborum.\n\n| Tables        | Are           | Cool  |\n| ------------- |:-------------:| -----:|\n| col 3 is      | right-aligned | $1600 |\n| col 2 is      | centered      |   $12 |\n| zebra stripes | are neat      |    $1 |\n\n```\n"},{"title":"This is a page","slug":"this-is-a-page","date":"15/03/2016","author":"Dynatic","layout":"Page","content":"\n# This is a page\n\n---\n\nThis is a page because we are using `layout: Page`.\n\n```markdown\n---\nslug: this-is-a-page\ntitle: This is a page\ndate: 15/03/2016\nauthor: Dynatic\nlayout: Page\n---\n\n# This is a page\n\n---\n\nThis is a page because we are using `layout: Page`.\n```\n"}]